[
  {
    "id": "ap-a-0083",
    "exam": "ap",
    "topic": "ap-M17-01",
    "type": "mcq",
    "difficulty": 2,
    "section": "A",
    "question": "全社で顧客情報が部門ごとに重複し、異なる顧客IDが付いている。全社的な情報システム戦略で優先すべきことはどれか。",
    "choices": [
      "画面色だけを統一する",
      "データの所有部門を曖昧にする",
      "顧客データの共通定義と識別ルールを整える",
      "各部門が独自IDをさらに増やす"
    ],
    "answer": 2,
    "choiceNotes": [
      "データの不一致は解消しない。",
      "品質責任が不明になる。",
      "共通のデータ定義と識別ルールがあれば、部門横断で顧客を対応付けられる。",
      "重複と不整合を拡大する。"
    ],
    "explanation": "共通のデータ定義と識別ルールがあれば、部門横断で顧客を対応付けられる。データの責任者も明確にする。",
    "keywords": [
      "情報システム戦略"
    ],
    "status": "verified",
    "origin": "original"
  },
  {
    "id": "ap-a-0084",
    "exam": "ap",
    "topic": "ap-M17-02",
    "type": "mcq",
    "difficulty": 2,
    "section": "A",
    "question": "申請が三部門を紙で巡回し、同じ項目を毎回転記している。業務改革の第一歩として適切なのはどれか。",
    "choices": [
      "現行を調べず全画面を作る",
      "転記を増やして確認回数を稼ぐ",
      "最終部門だけに端末を配る",
      "現行の処理・待ち時間・転記箇所を可視化する"
    ],
    "answer": 3,
    "choiceNotes": [
      "不要な処理をそのまま電子化し得る。",
      "業務負荷と誤記を増やす。",
      "全体の滞留を把握できない。",
      "現行の流れと滞留を測ると改善すべき箇所が明らかになる。"
    ],
    "explanation": "現行の流れと滞留を測ると改善すべき箇所が明らかになる。不要な転記や承認を見直してからシステム化する。",
    "keywords": [
      "業務プロセス"
    ],
    "status": "verified",
    "origin": "original"
  },
  {
    "id": "ap-a-0085",
    "exam": "ap",
    "topic": "ap-M17-03",
    "type": "mcq",
    "difficulty": 2,
    "section": "A",
    "question": "顧客企業へ月額で業務ソフトを提供し、運用も提供者が担う。契約時に特に明確化すべきものはどれか。",
    "choices": [
      "サービス範囲、可用性、データ返却条件",
      "提供開始時の機能数だけを決める",
      "月額料金だけを定める",
      "開発時のソース管理方法だけを定める"
    ],
    "answer": 0,
    "choiceNotes": [
      "継続的なサービス提供では範囲と品質の合意が必要である。",
      "可用性と終了時のデータ取扱いが曖昧である。",
      "サービスの品質と範囲が分からない。",
      "顧客が受けるサービス条件を示さない。"
    ],
    "explanation": "継続的なサービス提供では範囲と品質の合意が必要である。終了時のデータ取扱いも事前に決めておく。",
    "keywords": [
      "ソリューションビジネス"
    ],
    "status": "verified",
    "origin": "original"
  },
  {
    "id": "ap-a-0086",
    "exam": "ap",
    "topic": "ap-M17-04",
    "type": "mcq",
    "difficulty": 2,
    "section": "A",
    "question": "社内ツールの導入効果を評価したい。単なる利用回数に加えて重視すべき指標はどれか。",
    "choices": [
      "導入後のログイン回数だけを数える",
      "導入前後の処理時間や誤入力件数",
      "利用者の満足度だけを聞く",
      "配布した端末の台数だけを数える"
    ],
    "answer": 1,
    "choiceNotes": [
      "業務成果を示さない。",
      "導入効果は業務上の成果で評価する。",
      "客観的な時間や誤りの変化が分からない。",
      "利用による成果を測れない。"
    ],
    "explanation": "導入効果は業務上の成果で評価する。処理時間や誤入力の変化を導入前後で比較できる。",
    "keywords": [
      "システム活用促進・評価"
    ],
    "status": "verified",
    "origin": "original"
  },
  {
    "id": "ap-a-0087",
    "exam": "ap",
    "topic": "ap-M18-01",
    "type": "mcq",
    "difficulty": 2,
    "section": "A",
    "question": "新しい在庫システムの投資案が三つある。年度予算に収めて優先順位を決める際の比較方法はどれか。",
    "choices": [
      "初期費用だけが最小の案を選ぶ",
      "期待効果だけを比べる",
      "費用、期待効果、リスクと戦略適合を同じ基準で評価する",
      "提案順だけで採択する"
    ],
    "answer": 2,
    "choiceNotes": [
      "運用費と効果を無視する。",
      "費用や実現可能性を無視する。",
      "投資案は共通の評価軸で比較する。",
      "投資効果やリスクを比較できない。"
    ],
    "explanation": "投資案は共通の評価軸で比較する。費用と効果に加え、実現リスクや戦略との整合も判断に含める。",
    "keywords": [
      "システム化計画"
    ],
    "status": "verified",
    "origin": "original"
  },
  {
    "id": "ap-a-0088",
    "exam": "ap",
    "topic": "ap-M18-02",
    "type": "mcq",
    "difficulty": 2,
    "section": "A",
    "question": "利用者が「在庫が見えること」と要望した。要件定義で次に確認すべき内容はどれか。",
    "choices": [
      "画面の背景色だけ",
      "製品名だけを先に確定する",
      "要望を無条件で「リアルタイム」と解釈する",
      "誰が何をいつ見て、どの精度と遅延を許すか"
    ],
    "answer": 3,
    "choiceNotes": [
      "業務上の必要条件を特定できない。",
      "要件の具体化に先行している。",
      "必要な鮮度を推測している。",
      "抽象的な要望は利用者、対象データ、利用場面、必要な鮮度へ分解する。"
    ],
    "explanation": "抽象的な要望は利用者、対象データ、利用場面、必要な鮮度へ分解する。測定可能な条件にすれば設計と受入れに使える。",
    "keywords": [
      "要件定義"
    ],
    "status": "verified",
    "origin": "original"
  },
  {
    "id": "ap-a-0089",
    "exam": "ap",
    "topic": "ap-M18-03",
    "type": "mcq",
    "difficulty": 2,
    "section": "A",
    "question": "複数ベンダに同条件でシステム提案を求めたい。提案依頼書に記すべきものはどれか。",
    "choices": [
      "業務課題、要求範囲、制約、評価基準",
      "選定後の評価基準だけ",
      "特定製品の広告文だけ",
      "提案者ごとに異なる非公開要件"
    ],
    "answer": 0,
    "choiceNotes": [
      "共通の要求と制約を示すと提案を比較できる。",
      "比較条件が事前に共有されない。",
      "業務上の要求が伝わらない。",
      "公平に比較できない。"
    ],
    "explanation": "共通の要求と制約を示すと提案を比較できる。評価基準もあらかじめ明確にする。",
    "keywords": [
      "調達計画・実施"
    ],
    "status": "verified",
    "origin": "original"
  }
]
