[
  {
    "id": "ap-a-0075",
    "exam": "ap",
    "topic": "ap-M15-01",
    "type": "mcq",
    "difficulty": 2,
    "section": "A",
    "question": "サービス停止の問い合わせが急増した。復旧を優先しつつ根本原因の調査も進める場合、区別すべき活動はどれか。",
    "choices": [
      "変更管理で恒久対策を承認し、復旧対応もそこで完結させる",
      "サービス要求管理で利用者への回答を行い、原因をそこで追う",
      "インシデント管理で復旧し、問題管理で原因を追う",
      "問題管理で原因を調べ、原因判明後に利用者の復旧を始める"
    ],
    "answer": 2,
    "choiceNotes": [
      "変更管理は変更の統制であり、発生中の停止の復旧管理を代替しない。",
      "問い合わせ対応だけでは障害の復旧と根本原因の管理を分けられない。",
      "インシデント管理は早期のサービス回復を目指す。",
      "利用者の復旧を原因分析完了まで待たせるべきではない。"
    ],
    "explanation": "インシデント管理は早期のサービス回復を目指す。問題管理は根本原因と再発防止を扱う。",
    "keywords": [
      "サービスマネジメント"
    ],
    "status": "verified",
    "origin": "original"
  },
  {
    "id": "ap-a-0076",
    "exam": "ap",
    "topic": "ap-M15-02",
    "type": "mcq",
    "difficulty": 2,
    "section": "A",
    "question": "監視業務を外部へ委託する。サービスの責任分界を明確にするため、運用計画に最も必要な内容はどれか。",
    "choices": [
      "監視対象ごとの閾値と月次報告の提出期限",
      "障害時の連絡順と監視基盤の保守担当",
      "監視担当の勤務時間と監視対象の一覧",
      "検知から連絡・対応までの役割と時間目標"
    ],
    "answer": 3,
    "choiceNotes": [
      "検知条件と報告期限は示すが、検知後の対応責任が定まらない。",
      "連絡順は示すが、対応の責任分界と時間目標が不足する。",
      "監視体制は示すが、検知後の連絡と対応を定めていない。",
      "検知から対応までの責任と時間を両者で共有できる。"
    ],
    "explanation": "監視と対応の役割、連絡経路、時間目標を定める。委託先と自組織の境界で対応漏れを防げる。",
    "keywords": [
      "サービスマネジメントシステムの計画及び運用"
    ],
    "status": "verified",
    "origin": "original"
  },
  {
    "id": "ap-a-0077",
    "exam": "ap",
    "topic": "ap-M15-03",
    "type": "mcq",
    "difficulty": 3,
    "section": "A",
    "question": "月次SLAでは応答遅延の発生率が目標内だった。しかし毎営業日の開始直後に遅延が集中し、受注登録が滞る。改善判断に最も役立つ分析はどれか。",
    "choices": [
      "時間帯別の応答時間分布と利用者影響を分析する",
      "月次平均応答時間だけを追加で確認する",
      "遅延時間帯を除いた達成率だけを示す",
      "全時間帯のSLA目標を同じ値だけ緩和する"
    ],
    "answer": 0,
    "choiceNotes": [
      "集中時間帯と業務への影響を同時に把握できる。",
      "月次平均では特定時間の集中を隠す。",
      "影響が大きい時間帯を評価から外してしまう。",
      "原因と影響を見ずに目標を変えている。"
    ],
    "explanation": "月全体の達成率だけでは、業務開始直後の遅延が見えない。時間帯ごとの分布と受注登録への影響を確認して改善対象を決める。",
    "keywords": [
      "パフォーマンス評価及び改善"
    ],
    "status": "verified",
    "origin": "original"
  },
  {
    "id": "ap-a-0078",
    "exam": "ap",
    "topic": "ap-M15-04",
    "type": "mcq",
    "difficulty": 2,
    "section": "A",
    "question": "定期ジョブが失敗した場合、翌朝の業務開始前に復旧できるようにしたい。適切な運用設計はどれか。",
    "choices": [
      "失敗時に自動で無制限に再実行する",
      "失敗検知、通知、再実行条件、担当者を手順化する",
      "失敗を翌朝の定例確認で検知し、担当者へ通知する",
      "監視で警報を出し、再実行の判断はその場で担当者に任せる"
    ],
    "answer": 1,
    "choiceNotes": [
      "原因が残る場合に繰り返し失敗し、二重処理も起こり得る。",
      "ジョブ失敗後の検知から復旧までを具体化する。",
      "業務開始前に復旧する時間が足りなくなる可能性がある。",
      "担当や再実行条件が不明で対応が遅れる。"
    ],
    "explanation": "ジョブ失敗後の検知から復旧までを具体化する。再実行可能条件を定めれば二重処理も避けられる。",
    "keywords": [
      "サービスの運用"
    ],
    "status": "verified",
    "origin": "original"
  },
  {
    "id": "ap-a-0079",
    "exam": "ap",
    "topic": "ap-M15-05",
    "type": "mcq",
    "difficulty": 2,
    "section": "A",
    "question": "データセンターの電源設計を見直す。単一の給電系統が長時間停止してもサービスを継続でき、かつ冗長構成が実際に機能することを確かめられる設計はどれか。",
    "choices": [
      "二台の電源装置を同じ給電経路へ接続する",
      "UPSを置き、単一給電経路のまま運用する",
      "独立した給電経路を用意し切替試験を行う",
      "独立した二経路を用意し、切替条件は設計書に記すだけにする"
    ],
    "answer": 2,
    "choiceNotes": [
      "共通の給電経路が停止すると両方とも使えない。",
      "短時間の停電には備えられるが、給電経路の故障に対する冗長化ではない。",
      "給電経路を独立させると一系統の故障に耐えられる。",
      "設計上の切替が実際に機能するか確認できない。"
    ],
    "explanation": "給電経路を独立させると一系統の故障に耐えられる。切替試験で冗長構成が機能することを確かめる。",
    "keywords": [
      "ファシリティマネジメント"
    ],
    "status": "verified",
    "origin": "original"
  },
  {
    "id": "ap-a-0080",
    "exam": "ap",
    "topic": "ap-M16-01",
    "type": "mcq",
    "difficulty": 3,
    "section": "A",
    "question": "アクセス権の規程は対象期間の途中で承認者を変更した。監査人が旧・新規程の運用実態を確かめる証拠として最も適切なものはどれか。",
    "choices": [
      "担当者への聞取りと手続書の照合結果",
      "対象期間の承認記録だけを抽出した結果",
      "監査時点の権限設定だけを一覧化した結果",
      "各期間の申請・承認記録を抽出し、実際の権限設定と照合した結果"
    ],
    "answer": 3,
    "choiceNotes": [
      "説明だけでは実際の運用を確かめられない。",
      "承認記録だけでは設定された権限と結び付かない。",
      "監査時点だけでは旧規程の期間を確認できない。",
      "規程の適用期間ごとに承認と実設定の一致を確かめられる。"
    ],
    "explanation": "監査では手続書だけでなく、その期間に実際に行われた処理の証拠を確認する。規程の変更前後で申請・承認記録を抽出し、権限設定と照合する。",
    "keywords": [
      "システム監査"
    ],
    "status": "verified",
    "origin": "original"
  },
  {
    "id": "ap-a-0081",
    "exam": "ap",
    "topic": "ap-M16-02",
    "type": "mcq",
    "difficulty": 2,
    "section": "A",
    "question": "購買担当が取引先の登録と支払承認を一人で行える。内部統制上の対策はどれか。",
    "choices": [
      "取引先登録と支払承認を別の権限へ分ける",
      "取引先登録と支払承認を同じ担当者にし、日次で操作履歴を確認する",
      "取引先登録を二人で確認し、支払承認は登録担当が行う",
      "支払承認を金額で分け、低額は登録担当が承認する"
    ],
    "answer": 0,
    "choiceNotes": [
      "職務を分離すると一人で登録から支払まで完結できなくなる。",
      "事後確認は補完策になるが、一人で不正を完結できる権限が残る。",
      "登録の確認を増やしても登録担当が支払を承認できる。",
      "低額取引では職務分離が成立しない。"
    ],
    "explanation": "職務を分離すると一人で登録から支払まで完結できなくなる。相互確認が不正や誤りの抑止になる。",
    "keywords": [
      "内部統制"
    ],
    "status": "verified",
    "origin": "original"
  },
  {
    "id": "ap-a-0082",
    "exam": "ap",
    "topic": "ap-M16-01",
    "type": "mcq",
    "difficulty": 2,
    "section": "A",
    "question": "監査対象システムを自ら開発した担当者を、その同じシステムの監査責任者に指名しようとしている。主な懸念はどれか。",
    "choices": [
      "開発時の設計書だけを監査資料に使うと範囲が狭まる",
      "自己レビューによって監査の客観性が損なわれる",
      "監査証拠の収集手順を開発時の手順に合わせやすい",
      "開発時の仕様変更履歴を確認する作業が増える"
    ],
    "answer": 1,
    "choiceNotes": [
      "監査資料の選び方の問題であり、同じ担当者を責任者にする固有の懸念ではない。",
      "自分が開発したシステムを自分で評価すると独立した判断が難しい。",
      "作業の容易さは主な懸念ではない。",
      "仕様変更履歴の確認は監査に必要な場合もあり、指名の主な懸念ではない。"
    ],
    "explanation": "自らの開発成果を監査すると判断に利害が入りやすい。独立した立場の監査人を置いて客観性を確保する。",
    "keywords": [
      "システム監査"
    ],
    "status": "verified",
    "origin": "original"
  },
  {
    "id": "ap-b-0012",
    "exam": "ap",
    "topic": "ap-M15-04",
    "type": "self",
    "difficulty": 2,
    "section": "B",
    "question": "夜間の請求バッチが途中で停止した。\n翌朝までに請求データを用意する必要がある。\n途中まで書き込まれた請求行が存在する。\n運用担当はジョブを最初から再実行しようとしている。\n二重請求を防ぐ手順はまだない。\n問：再実行前に確認すべきことを述べよ。",
    "modelAnswer": "処理済み範囲と書込み状態を確認し、重複しない再開点又は取消し手順を決める。",
    "rubric": [
      "処理済み範囲を確認する",
      "二重書込みを防ぐ再開又は取消しを定める",
      "再実行を無条件に始めない"
    ],
    "explanation": "途中までの結果を残したまま最初から実行すると重複し得る。状態を把握して安全な再開方法を決める。",
    "keywords": [
      "サービスの運用"
    ],
    "status": "verified",
    "origin": "original"
  },
  {
    "id": "ap-b-0013",
    "exam": "ap",
    "topic": "ap-M16-01",
    "type": "self",
    "difficulty": 2,
    "section": "B",
    "question": "監査人が購買システムの支払承認を確認する。\n規程では申請者と承認者を分けることになっている。\n担当者は「普段は守っている」と説明した。\n監査対象期間は直近3か月である。\nシステムには操作履歴と承認記録が保存されている。\n問：運用実態を確かめる監査手続を述べよ。",
    "modelAnswer": "対象期間の申請・承認記録を抽出し、申請者と承認者が分離されているか照合する。",
    "rubric": [
      "対象期間の記録を抽出する",
      "申請者と承認者を照合する",
      "口頭説明だけで結論を出さない"
    ],
    "explanation": "規程の存在や口頭説明だけでは運用を確認できない。実際の記録を母集団にして職務分離を検証する。",
    "keywords": [
      "システム監査"
    ],
    "status": "verified",
    "origin": "original"
  }
]
