[
  {
    "id": "fe-a-0014",
    "exam": "fe",
    "topic": "fe-M03-01",
    "type": "mcq",
    "difficulty": 2,
    "section": "A",
    "question": "クロック2 GHz、平均CPIが4のCPUが、10億命令を実行する時間はどれか。",
    "choices": [
      "0.5秒",
      "2秒",
      "8秒",
      "4秒"
    ],
    "answer": 1,
    "choiceNotes": [
      "CPIを掛けずに命令数をクロックで割っている。",
      "必要なクロック数は10億×4=40億である。",
      "CPIを重複して掛けている。",
      "クロック周波数を1 GHzと取り違えている。"
    ],
    "explanation": "必要なクロック数は10億×4=40億である。40億クロックを毎秒20億クロックで処理するので2秒かかる。",
    "keywords": [
      "プロセッサ"
    ],
    "status": "verified",
    "origin": "original"
  },
  {
    "id": "fe-a-0015",
    "exam": "fe",
    "topic": "fe-M03-01",
    "type": "mcq",
    "difficulty": 2,
    "section": "A",
    "question": "1秒間に600万命令を実行するCPUの性能は何MIPSか。",
    "choices": [
      "6 MIPS",
      "0.6 MIPS",
      "600 MIPS",
      "60 MIPS"
    ],
    "answer": 0,
    "choiceNotes": [
      "MIPSは1秒間に実行する命令数を百万単位で表す。",
      "百万の換算を1桁誤っている。",
      "命令数を百万単位にしていない。",
      "百万の換算を1桁誤っている。"
    ],
    "explanation": "MIPSは1秒間に実行する命令数を百万単位で表す。600万命令/秒は6 MIPSである。",
    "keywords": [
      "プロセッサ"
    ],
    "status": "verified",
    "origin": "original"
  },
  {
    "id": "fe-a-0016",
    "exam": "fe",
    "topic": "fe-M03-02",
    "type": "mcq",
    "difficulty": 3,
    "section": "A",
    "question": "キャッシュのヒット時は2 ns、ミス時の全アクセスは42 nsである。平均アクセス時間を6 ns以下にするため、必要なヒット率の最小値はどれか。",
    "choices": [
      "80%",
      "95%",
      "85%",
      "90%"
    ],
    "answer": 3,
    "choiceNotes": [
      "平均は42−40×0.80=10 nsとなり目標を超える。",
      "平均は4 nsになるが、最小の必要値ではない。",
      "平均は42−40×0.85=8 nsとなり目標を超える。",
      "42−40h≤6を満たす最小のhは0.90である。"
    ],
    "explanation": "ヒット率をhとすると平均は2h+42(1−h)=42−40h nsである。これを6 ns以下にするにはh≥0.90が必要なので、最小値は90%である。",
    "keywords": [
      "メモリ"
    ],
    "status": "verified",
    "origin": "original"
  },
  {
    "id": "fe-a-0017",
    "exam": "fe",
    "topic": "fe-M03-03",
    "type": "mcq",
    "difficulty": 2,
    "section": "A",
    "question": "CPUが主記憶から値を読む際、アドレスバスに載せる情報はどれか。",
    "choices": [
      "読み出した値",
      "読出しを指示する制御信号",
      "読み出す位置",
      "転送が完了したという応答"
    ],
    "answer": 2,
    "choiceNotes": [
      "値はデータバスを通る。",
      "読出し指示は制御信号で伝える。",
      "アドレスバスは対象の位置を示す。",
      "完了応答もアドレスそのものではない。"
    ],
    "explanation": "CPUはアドレスバスで対象の位置を指定する。値の転送にはデータバス、動作の指示には制御信号を使う。",
    "keywords": [
      "バス"
    ],
    "status": "verified",
    "origin": "original"
  },
  {
    "id": "fe-a-0018",
    "exam": "fe",
    "topic": "fe-M03-04",
    "type": "mcq",
    "difficulty": 1,
    "section": "A",
    "question": "印刷された一次元バーコードを読み取って商品コードを入力する装置はどれか。",
    "choices": [
      "RFIDリーダ",
      "イメージスキャナ",
      "OCR装置",
      "バーコードリーダ"
    ],
    "answer": 3,
    "choiceNotes": [
      "無線タグを読み取り、印刷されたバーは読まない。",
      "紙面全体を画像として取得する用途が中心である。",
      "文字の形を認識する装置である。",
      "バーの幅の並びを読み取りコードへ変換する。"
    ],
    "explanation": "バーコードリーダは印刷されたバーの並びを読み取り、コードへ変換する。OCRは文字、RFIDリーダは無線タグを対象にする。",
    "keywords": [
      "入出力デバイス"
    ],
    "status": "verified",
    "origin": "original"
  },
  {
    "id": "fe-a-0019",
    "exam": "fe",
    "topic": "fe-M03-05",
    "type": "mcq",
    "difficulty": 1,
    "section": "A",
    "question": "A社が大量の紙の契約書を一定の解像度でページ画像として連続保存する。最も適した入力装置はどれか。",
    "choices": [
      "デジタルカメラ",
      "OCR装置",
      "スキャナ",
      "プロッタ"
    ],
    "answer": 2,
    "choiceNotes": [
      "紙面を撮影できるが、大量のページを一定条件で連続して取り込む用途にはスキャナが適する。",
      "画像中の文字を認識する処理に用いる。",
      "紙面を光学的に読み取って画像化する。",
      "図面を紙へ出力する装置である。"
    ],
    "explanation": "スキャナは紙面を光学的に読み取り、画像データにする。文字を検索可能にする場合は、取り込み後にOCRを使うこともある。",
    "keywords": [
      "入出力装置"
    ],
    "status": "verified",
    "origin": "original"
  },
  {
    "id": "fe-a-0020",
    "exam": "fe",
    "topic": "fe-M04-01",
    "type": "mcq",
    "difficulty": 2,
    "section": "A",
    "question": "独立に稼働する装置2台を並列に配置し、どちらか1台が動けばサービスを提供できる。それぞれの稼働率が0.9のとき、全体の稼働率はどれか。",
    "choices": [
      "0.99",
      "0.9",
      "0.98",
      "0.81"
    ],
    "answer": 0,
    "choiceNotes": [
      "両方が停止する確率は0.1×0.1=0.01である。",
      "冗長化による改善を反映していない。",
      "両装置の停止率を足してから1から引いており、独立性による積を使っていない。",
      "両方が動く確率であり、片方だけ動く場合を除いている。"
    ],
    "explanation": "両方が停止する確率は0.1×0.1=0.01である。少なくとも1台が動く確率は1−0.01=0.99となる。",
    "keywords": [
      "システムの構成"
    ],
    "status": "verified",
    "origin": "original"
  },
  {
    "id": "fe-a-0021",
    "exam": "fe",
    "topic": "fe-M04-02",
    "type": "mcq",
    "difficulty": 3,
    "section": "A",
    "question": "A社の装置は平均100時間稼働して故障し、修復に平均25時間かかる。稼働率と停止率の組合せはどれか。",
    "choices": [
      "稼働率100%、停止率0%",
      "稼働率80%、停止率20%",
      "稼働率75%、停止率25%",
      "稼働率20%、停止率80%"
    ],
    "answer": 1,
    "choiceNotes": [
      "平均修復時間があるので停止率は0%ではない。",
      "100÷(100+25)=0.8で、残りが停止率である。",
      "修復時間を稼働時間100時間だけで割っている。",
      "MTBFとMTTRを逆に使っている。"
    ],
    "explanation": "平均の1サイクルは稼働100時間と修復25時間の計125時間である。稼働率は100÷125=80%、停止率は25÷125=20%となる。",
    "keywords": [
      "システムの評価指標"
    ],
    "status": "verified",
    "origin": "original"
  },
  {
    "id": "fe-a-0022",
    "exam": "fe",
    "topic": "fe-M05-01",
    "type": "mcq",
    "difficulty": 2,
    "section": "A",
    "question": "実行可能な処理が三つある。OSが一定時間ごとにCPUの割当先を切り替える役割はどれか。",
    "choices": [
      "スケジューリング",
      "割込み処理",
      "排他制御",
      "メモリ割当て"
    ],
    "answer": 0,
    "choiceNotes": [
      "CPUを使う処理と順序を決める。",
      "発生した事象へ制御を移す仕組みである。",
      "共有資源の同時操作を制限する役割である。",
      "主記憶の領域を割り当てる役割である。"
    ],
    "explanation": "複数の実行可能な処理からCPUを使う対象を選ぶのがスケジューリングである。時間を区切る方式では割当先を順に切り替える。",
    "keywords": [
      "オペレーティングシステム"
    ],
    "status": "verified",
    "origin": "original"
  },
  {
    "id": "fe-a-0023",
    "exam": "fe",
    "topic": "fe-M05-02",
    "type": "mcq",
    "difficulty": 2,
    "section": "A",
    "question": "A社は複数の業務アプリから共通のDB接続管理機能を使う。アプリとOSの間でこの機能を提供する層はどれか。",
    "choices": [
      "ブートローダ",
      "ミドルウェア",
      "デバイスドライバ",
      "ハイパーバイザ"
    ],
    "answer": 1,
    "choiceNotes": [
      "起動時にOSを読み込む仕組みである。",
      "アプリに共通の基盤機能を提供する。",
      "特定の機器をOSから制御する層である。",
      "仮想マシンを動かす基盤である。"
    ],
    "explanation": "DB接続管理のような共通機能をアプリへ提供するソフトウェアはミドルウェアである。OSと個々のアプリの間で利用される。",
    "keywords": [
      "ミドルウェア"
    ],
    "status": "verified",
    "origin": "original"
  },
  {
    "id": "fe-a-0024",
    "exam": "fe",
    "topic": "fe-M05-03",
    "type": "mcq",
    "difficulty": 1,
    "section": "A",
    "question": "絶対パス /reports/2026/summary.txt の末尾 summary.txt はどれか。",
    "choices": [
      "拡張子",
      "ファイル名",
      "ルートディレクトリ",
      "親ディレクトリ"
    ],
    "answer": 1,
    "choiceNotes": [
      "拡張子はtxtである。",
      "パスの末尾にある対象の名前である。",
      "ルートは先頭の/である。",
      "親ディレクトリは2026である。"
    ],
    "explanation": "末尾のsummary.txtがファイル名である。途中のreportsと2026はディレクトリを表す。",
    "keywords": [
      "ファイルシステム"
    ],
    "status": "verified",
    "origin": "original"
  },
  {
    "id": "fe-a-0025",
    "exam": "fe",
    "topic": "fe-M05-04",
    "type": "mcq",
    "difficulty": 2,
    "section": "A",
    "question": "テストで実行されなかった分岐を調べたい。開発者が測定結果として見るべきものはどれか。",
    "choices": [
      "静的解析の警告数",
      "行カバレッジ",
      "分岐カバレッジ",
      "実行時間の分布"
    ],
    "answer": 2,
    "choiceNotes": [
      "実行前の警告数であり、テストで通った経路は示さない。",
      "行の実行だけでは分岐の両側を確認できない。",
      "条件分岐の各結果が実行されたかを測る。",
      "速度の測定であり、分岐の実行範囲は示さない。"
    ],
    "explanation": "分岐カバレッジは各分岐の真偽の経路が実行されたかを測る。行カバレッジが高くても片側しか通っていない場合がある。",
    "keywords": [
      "開発ツール"
    ],
    "status": "verified",
    "origin": "original"
  },
  {
    "id": "fe-a-0026",
    "exam": "fe",
    "topic": "fe-M05-05",
    "type": "mcq",
    "difficulty": 1,
    "section": "A",
    "question": "OSSを製品へ組み込んで再配布する前に、改変や表示義務の条件として確認するものはどれか。",
    "choices": [
      "配布元のREADME",
      "バージョン番号",
      "依存関係一覧",
      "ライセンス"
    ],
    "answer": 3,
    "choiceNotes": [
      "説明文に利用条件の要約があっても、許諾条件の本体を確認する必要がある。",
      "版を識別する情報であり、利用許諾の内容ではない。",
      "関連する部品の把握には役立つが、許諾の範囲は定めない。",
      "利用・改変・再配布の条件を定める。"
    ],
    "explanation": "OSSの利用や再配布の条件はライセンスに従う。製品に組み込む際は表示義務なども確認する。",
    "keywords": [
      "オープンソースソフトウェア"
    ],
    "status": "verified",
    "origin": "original"
  },
  {
    "id": "fe-a-0027",
    "exam": "fe",
    "topic": "fe-M06-01",
    "type": "mcq",
    "difficulty": 1,
    "section": "A",
    "question": "電源を切ると内容が失われる作業領域として使う半導体メモリはどれか。",
    "choices": [
      "RAM",
      "SSD",
      "フラッシュメモリ",
      "ROM"
    ],
    "answer": 0,
    "choiceNotes": [
      "通常の主記憶に使う揮発性メモリである。",
      "不揮発性の記憶装置である。",
      "電源が切れても内容を保持する。",
      "通常は読み出し中心の不揮発性メモリである。"
    ],
    "explanation": "主記憶に使うRAMは一般に揮発性である。SSDやフラッシュメモリは電源断後も内容を保持する。",
    "keywords": [
      "ハードウェア"
    ],
    "status": "verified",
    "origin": "original"
  }
]
