[
  {
    "id": "fe-a-0061",
    "exam": "fe",
    "topic": "fe-M14-01",
    "type": "mcq",
    "difficulty": 1,
    "section": "A",
    "question": "期間と成果物が決まった開発を、納期・費用・品質の目標に沿って管理する活動はどれか。",
    "choices": [
      "資源マネジメント",
      "プロジェクトマネジメント",
      "品質マネジメント",
      "サービスマネジメント"
    ],
    "answer": 1,
    "choiceNotes": [
      "人員などの資源に焦点を当てる活動であり、全体の統合管理ではない。",
      "一時的な取組の計画と進捗を全体で管理する。",
      "品質に焦点を当てる活動であり、納期と費用を含む全体管理ではない。",
      "継続して提供するサービスの管理が中心である。"
    ],
    "explanation": "プロジェクトマネジメントは期限と成果物がある取組を計画・管理する。納期、費用、品質などを合わせて判断する。",
    "keywords": [
      "プロジェクトマネジメント"
    ],
    "status": "verified",
    "origin": "original"
  },
  {
    "id": "fe-a-0062",
    "exam": "fe",
    "topic": "fe-M14-02",
    "type": "mcq",
    "difficulty": 3,
    "section": "A",
    "question": "A社の開発中に追加機能が提案された。納期と費用の見積りも変わるため、承認前に行う対応はどれか。",
    "choices": [
      "影響を評価し、承認後に計画を更新する",
      "変更の評価前に機能を仮実装し、その結果だけで採否を決める",
      "費用への影響だけを評価し、日程は承認後に見直す",
      "要望部門の優先度だけで採用を決める"
    ],
    "answer": 0,
    "choiceNotes": [
      "変更の影響をまとめて評価できる。",
      "試作は参考になるが、納期・費用・品質への全体影響も確認する必要がある。",
      "承認前に日程への影響も把握する必要がある。",
      "他の目標への影響を評価できない。"
    ],
    "explanation": "統合変更管理では変更が費用、日程、品質などへ与える影響を評価する。承認された変更を計画へ反映する。",
    "keywords": [
      "プロジェクトの統合"
    ],
    "status": "verified",
    "origin": "original"
  },
  {
    "id": "fe-a-0063",
    "exam": "fe",
    "topic": "fe-M14-03",
    "type": "mcq",
    "difficulty": 2,
    "section": "A",
    "question": "予約システムの画面変更で、利用部門は操作時間、運用部門は障害対応、開発会社は実装量を重視する。まず行うことはどれか。",
    "choices": [
      "利用部門の操作時間だけを評価して確定する",
      "画面案を先に選び、関係者の期待は後で整理する",
      "開発会社の実装量だけを優先して決める",
      "関係者と関心事を特定して整理する"
    ],
    "answer": 3,
    "choiceNotes": [
      "運用や実装の制約も確認する必要がある。",
      "期待の違いを把握せずに案を固定すると手戻りしやすい。",
      "利用部門と運用部門の関心が残る。",
      "調整に必要な関係者の期待を把握できる。"
    ],
    "explanation": "ステークホルダを特定し、各者の関心事を把握する。異なる期待を整理してから調整方針を決める。",
    "keywords": [
      "プロジェクトのステークホルダ"
    ],
    "status": "verified",
    "origin": "original"
  },
  {
    "id": "fe-a-0064",
    "exam": "fe",
    "topic": "fe-M14-04",
    "type": "mcq",
    "difficulty": 1,
    "section": "A",
    "question": "成果物を階層的に分け、実行・見積りができる小さな作業単位まで整理したものはどれか。",
    "choices": [
      "ネットワーク図",
      "組織分解構成図",
      "ガントチャート",
      "WBS"
    ],
    "answer": 3,
    "choiceNotes": [
      "作業の順序や依存関係を示す。",
      "組織と責任の構造を示す。",
      "作業の時期を横棒で示す。",
      "成果物と作業範囲を階層的に分解する。"
    ],
    "explanation": "WBSは作業範囲を階層的に分解する。担当や日程の割当てに先立ち、必要な作業を明確にできる。",
    "keywords": [
      "プロジェクトのスコープ"
    ],
    "status": "verified",
    "origin": "original"
  },
  {
    "id": "fe-a-0065",
    "exam": "fe",
    "topic": "fe-M14-05",
    "type": "mcq",
    "difficulty": 3,
    "section": "A",
    "question": "設計担当Xは週18時間、担当Yは週10時間使える。作業AはXに12時間、作業BはXに9時間割り当て済みで、Bのうち3時間はYも担当できる。資源制約を満たす調整はどれか。",
    "choices": [
      "Bの3時間をYへ追加し、Xの割当ては残す",
      "Bの3時間をXからYへ移す",
      "Xの作業時間を21時間のままにする",
      "Aの3時間をXからYへ移す"
    ],
    "answer": 1,
    "choiceNotes": [
      "Xの超過が解消されない。",
      "Xは12+9−3=18時間、Yは3時間となる。",
      "Xの上限18時間を超える。",
      "AをYが担当できるとは示されていない。"
    ],
    "explanation": "Xの当初の割当ては12+9=21時間で、上限を3時間超える。Bの3時間をYへ移せばXは18時間、Yは3時間で両者の上限内に収まる。",
    "keywords": [
      "プロジェクトの資源"
    ],
    "status": "verified",
    "origin": "original"
  },
  {
    "id": "fe-a-0066",
    "exam": "fe",
    "topic": "fe-M14-06",
    "type": "mcq",
    "difficulty": 3,
    "section": "A",
    "question": "作業Aは3日、その後Bが4日とCが2日を並行し、両方の後にDが5日かかる。AとDは短縮できない。Bの短縮費は1日4万円、Cは1日2万円である。全体を少なくとも1日短縮する最小費用の案はどれか。",
    "choices": [
      "Bを1日短縮し、4万円を使う",
      "Bを2日短縮し、8万円を使う",
      "Cを1日短縮し、2万円を使う",
      "BとCを1日ずつ短縮し、6万円を使う"
    ],
    "answer": 0,
    "choiceNotes": [
      "長い経路を1日縮め、要件を最小費用で満たす。",
      "全体は縮むが費用が高い。",
      "短い経路だけを縮めても全体は変わらない。",
      "全体は縮むがCの短縮費が余分である。"
    ],
    "explanation": "A→B→Dは3+4+5=12日、A→C→Dは3+2+5=10日である。Bを1日縮めると最長経路は11日になり、費用4万円が条件を満たす案の中で最小となる。",
    "keywords": [
      "プロジェクトの時間"
    ],
    "status": "verified",
    "origin": "original"
  },
  {
    "id": "fe-a-0067",
    "exam": "fe",
    "topic": "fe-M14-07",
    "type": "mcq",
    "difficulty": 3,
    "section": "A",
    "question": "ある時点の計画価値PVが80万円、出来高EVが70万円、実コストACが90万円である。コスト差異CVはどれか。",
    "choices": [
      "＋20万円",
      "10万円",
      "−20万円",
      "−10万円"
    ],
    "answer": 2,
    "choiceNotes": [
      "差の大きさは合うが、EV−ACの符号を逆にしている。",
      "PV−EVの符号でありCVではない。",
      "コスト差異CVはEV−ACで求める。",
      "EV−PVはスケジュール差異である。"
    ],
    "explanation": "コスト差異CVはEV−ACで求める。70−90=−20万円なので予算超過を示す。",
    "keywords": [
      "プロジェクトのコスト"
    ],
    "status": "verified",
    "origin": "original"
  },
  {
    "id": "fe-a-0068",
    "exam": "fe",
    "topic": "fe-M14-08",
    "type": "mcq",
    "difficulty": 3,
    "section": "A",
    "question": "供給停止の可能性は低いが、停止すると作業が数日止まる。事前に代替調達先を決めておく対応はどれか。",
    "choices": [
      "リスクの回避",
      "リスクの影響を抑える対応",
      "リスクの転嫁",
      "リスクの受容"
    ],
    "answer": 1,
    "choiceNotes": [
      "停止する可能性のある作業自体をやめる。",
      "発生しても代替先で停止期間を短くできる。",
      "損失の負担を契約などで他者へ移す。",
      "発生時の備えを特に用意せず受け入れる。"
    ],
    "explanation": "代替調達先を準備するのは、リスクが現実化した場合の影響を抑える対応である。発生前に手順を決めておく。",
    "keywords": [
      "プロジェクトのリスク"
    ],
    "status": "verified",
    "origin": "original"
  },
  {
    "id": "fe-a-0069",
    "exam": "fe",
    "topic": "fe-M14-09",
    "type": "mcq",
    "difficulty": 3,
    "section": "A",
    "question": "レビューで見つかった不具合の半数が入力条件の見落としだった。次の開発のレビュー段階で同種の見落としを減らす対応はどれか。",
    "choices": [
      "入力条件のレビュー観点を追加し、次回の発生数を測る",
      "次回のレビュー時間だけを増やす",
      "入力条件のテスト項目だけを増やす",
      "不具合を担当者別に集計して個人へ注意する"
    ],
    "answer": 0,
    "choiceNotes": [
      "原因に合う予防策を入れ、効果も確かめられる。",
      "観点が変わらなければ同じ条件を見落とすおそれがある。",
      "検出は強化できるが、レビュー段階での見落としの予防を優先する設問である。",
      "入力条件という共通の原因に対する工程改善になりにくい。"
    ],
    "explanation": "不具合の傾向から入力条件の見落としが主因と分かる。レビューの観点を改善し、次回の発生状況で効果を確かめる。",
    "keywords": [
      "プロジェクトの品質"
    ],
    "status": "verified",
    "origin": "original"
  },
  {
    "id": "fe-a-0070",
    "exam": "fe",
    "topic": "fe-M14-10",
    "type": "mcq",
    "difficulty": 3,
    "section": "A",
    "question": "A社は外部委託先3社から同じ条件で提案を受けたい。成果物、納期、評価基準を示して依頼する文書はどれか。",
    "choices": [
      "契約締結後の作業指示書",
      "検収結果報告書",
      "提案依頼書",
      "運用開始後の障害報告書"
    ],
    "answer": 2,
    "choiceNotes": [
      "契約後の具体的な指示であり、提案比較の前段ではない。",
      "納品後の確認結果を記録する。",
      "候補各社へ要求と評価方法を共有する。",
      "運用中の問題を記録する。"
    ],
    "explanation": "提案依頼書には要求事項や評価基準を記す。各社に同じ条件を示せば提案を比較しやすくなる。",
    "keywords": [
      "プロジェクトの調達"
    ],
    "status": "verified",
    "origin": "original"
  },
  {
    "id": "fe-a-0071",
    "exam": "fe",
    "topic": "fe-M14-11",
    "type": "mcq",
    "difficulty": 3,
    "section": "A",
    "question": "会議で仕様変更を決めたが、欠席した開発担当には旧仕様が残っている。認識のずれを減らす共有方法はどれか。",
    "choices": [
      "完成時に変更履歴をまとめ、関係者へ通知する",
      "変更箇所だけをチャットに流し、担当と適用時期は省く",
      "決定事項・担当者・適用時期を記録し関係者へ伝える",
      "議事録を参加者だけに配り、欠席者には後で口頭説明する"
    ],
    "answer": 2,
    "choiceNotes": [
      "実装中に旧仕様との食い違いを防げない。",
      "誰がいつ対応するか共有できない。",
      "行動に必要な内容を欠席者も確認できる。",
      "欠席者が同じ決定内容を適時に参照できない。"
    ],
    "explanation": "決定内容、担当、適用時期を記録して関係者へ共有する。欠席者も同じ情報を参照でき、手戻りを減らせる。",
    "keywords": [
      "プロジェクトのコミュニケーション"
    ],
    "status": "verified",
    "origin": "original"
  },
  {
    "id": "fe-a-0072",
    "exam": "fe",
    "topic": "fe-M14-06",
    "type": "mcq",
    "difficulty": 2,
    "section": "A",
    "question": "先行作業Aが2日、Aの後に並行するBが5日とCが3日、両方の完了後にDが1日かかる。開始から完了まで最短何日か。",
    "choices": [
      "6日",
      "11日",
      "7日",
      "8日"
    ],
    "answer": 3,
    "choiceNotes": [
      "短いA→C→Dだけを見ている。",
      "並行するBとCを足している。",
      "A→B→Dの経路からDの1日を落としている。",
      "A→B→Dは2+5+1=8日、A→C→Dは2+3+1=6日である。"
    ],
    "explanation": "A→B→Dは2+5+1=8日、A→C→Dは2+3+1=6日である。長い経路が完了日を決めるので8日である。",
    "keywords": [
      "プロジェクトの時間"
    ],
    "status": "verified",
    "origin": "original"
  }
]
