[
  {
    "id": "fe-a-0088",
    "exam": "fe",
    "topic": "fe-M19-01",
    "type": "mcq",
    "difficulty": 3,
    "section": "A",
    "question": "A社は新製品の開発に必要な検査設備を持たない。一方、競合は同種製品の販売を始めた。SWOT分析でこの二つの状況の組合せはどれか。",
    "choices": [
      "強みと脅威",
      "弱みと機会",
      "強みと機会",
      "弱みと脅威"
    ],
    "answer": 3,
    "choiceNotes": [
      "設備不足は内部の弱みである。",
      "競合の参入は外部の脅威である。",
      "両方の分類が逆である。",
      "設備不足は内部の弱み、競合の参入は外部の脅威である。"
    ],
    "explanation": "必要な設備を持たないことは自社内部の弱みである。競合の参入は外部の脅威なので、弱みと脅威の組合せになる。",
    "keywords": [
      "経営戦略手法"
    ],
    "status": "verified",
    "origin": "original"
  },
  {
    "id": "fe-a-0089",
    "exam": "fe",
    "topic": "fe-M19-02",
    "type": "mcq",
    "difficulty": 3,
    "section": "A",
    "question": "A社は購入頻度と購入金額で顧客を四つの群に分ける。高頻度・低金額の群向け施策を考える前に、この分類で行ったことはどれか。",
    "choices": [
      "重点顧客群の選定",
      "顧客の特徴による市場細分化",
      "全顧客への一律の案内",
      "競合に対する位置付けの決定"
    ],
    "answer": 1,
    "choiceNotes": [
      "どの群を重点対象にするかはまだ決めていない。",
      "二つの軸で顧客を群に分けている。",
      "群ごとに分けているので一律ではない。",
      "競合と比べた提供価値は定めていない。"
    ],
    "explanation": "購買頻度と金額という特徴で顧客を分けるのはセグメンテーションである。対象群の選定や施策の決定はその後に行う。",
    "keywords": [
      "マーケティング"
    ],
    "status": "verified",
    "origin": "original"
  },
  {
    "id": "fe-a-0090",
    "exam": "fe",
    "topic": "fe-M19-03",
    "type": "mcq",
    "difficulty": 2,
    "section": "A",
    "question": "売上目標1,000万円に対し実績が900万円だった。目標達成率はどれか。",
    "choices": [
      "110%",
      "10%",
      "90%",
      "111.1%"
    ],
    "answer": 2,
    "choiceNotes": [
      "目標から不足した100万円を加算する誤りである。",
      "目標との差の割合である。",
      "達成率は実績/目標×100で求める。",
      "実績を分母にしている。"
    ],
    "explanation": "達成率は実績/目標×100で求める。900/1,000×100=90%である。",
    "keywords": [
      "ビジネス戦略と目標・評価"
    ],
    "status": "verified",
    "origin": "original"
  },
  {
    "id": "fe-a-0091",
    "exam": "fe",
    "topic": "fe-M19-04",
    "type": "mcq",
    "difficulty": 3,
    "section": "A",
    "question": "A社の経営層は支店別売上の総額に加え、急に減った支店の製品別内訳を見たい。経営情報システムの機能として適切なのはどれか。",
    "choices": [
      "支店別の値から製品別の内訳へ掘り下げる",
      "支店別総額の順位だけを毎月表示する",
      "製品別総額を全社一括で表示する",
      "支店別総額と全社の製品別総額を別々に表示する"
    ],
    "answer": 0,
    "choiceNotes": [
      "集計から詳細へたどり、要因を調べられる。",
      "減少した支店の製品別要因を調べられない。",
      "支店ごとの製品内訳を確認できない。",
      "減少した支店の内訳へ結び付けられない。"
    ],
    "explanation": "経営情報システムでは集計値だけでなく詳細へ掘り下げる分析も役立つ。支店から製品別内訳へたどれば、減少の要因を調べやすい。",
    "keywords": [
      "経営管理システム"
    ],
    "status": "verified",
    "origin": "original"
  },
  {
    "id": "fe-a-0092",
    "exam": "fe",
    "topic": "fe-M20-01",
    "type": "mcq",
    "difficulty": 3,
    "section": "A",
    "question": "A社には二つの技術候補がある。技術Xは強みがあるが市場需要は縮小し、技術Yは未熟だが需要が伸びる。投資先を決める前に最も適切な評価はどれか。",
    "choices": [
      "需要の伸びだけでYを選ぶ",
      "現在の技術力だけでXを選ぶ",
      "事業方針と技術力、将来需要を合わせて比較する",
      "開発費だけが少ない技術を選ぶ"
    ],
    "answer": 2,
    "choiceNotes": [
      "必要な技術獲得と事業との適合を見落とす。",
      "需要の縮小と事業方針を見落とす。",
      "投資判断に必要な複数の条件を評価する。",
      "市場と技術力の両面を評価できない。"
    ],
    "explanation": "技術開発戦略では自社の強みと事業方針、市場の将来性を結び付ける。一つの条件だけで投資先を決めない。",
    "keywords": [
      "技術開発戦略の立案"
    ],
    "status": "verified",
    "origin": "original"
  },
  {
    "id": "fe-a-0093",
    "exam": "fe",
    "topic": "fe-M20-02",
    "type": "mcq",
    "difficulty": 1,
    "section": "A",
    "question": "技術ごとの到達目標と予定時期を並べ、開発の順序を示すものはどれか。",
    "choices": [
      "技術ロードマップ",
      "特許一覧",
      "製品ポートフォリオ",
      "ガントチャート"
    ],
    "answer": 0,
    "choiceNotes": [
      "技術の目標と時期の関係を示す。",
      "権利の保有状況を示す。",
      "事業や製品を位置付けて比較する。",
      "作業の日程を示すが技術の獲得順序そのものではない。"
    ],
    "explanation": "技術ロードマップは将来必要な技術と到達時期を対応付ける。研究テーマ間の順序や依存関係を共有できる。",
    "keywords": [
      "技術開発計画"
    ],
    "status": "verified",
    "origin": "original"
  },
  {
    "id": "fe-a-0094",
    "exam": "fe",
    "topic": "fe-M21-03",
    "type": "mcq",
    "difficulty": 1,
    "section": "A",
    "question": "複数の売り手と買い手がネット上で取引する場を提供する事業形態はどれか。",
    "choices": [
      "自社直販サイト",
      "アフィリエイト",
      "EDI",
      "電子マーケットプレイス"
    ],
    "answer": 3,
    "choiceNotes": [
      "主に自社が売り手となる。",
      "紹介に応じて報酬を得る仕組みである。",
      "企業間の取引データを交換する仕組みである。",
      "複数の売り手と買い手を仲介する。"
    ],
    "explanation": "電子マーケットプレイスは複数の取引参加者を結び付ける。単一企業の直販サイトとは参加者の関係が異なる。",
    "keywords": [
      "e-ビジネス"
    ],
    "status": "verified",
    "origin": "original"
  }
]
