[
  {
    "id": "ap-a-0099",
    "exam": "ap",
    "topic": "ap-M22-01",
    "type": "mcq",
    "difficulty": 2,
    "section": "A",
    "question": "機能別組織で製品横断の意思決定が遅い。製品責任者に複数部門の調整権限を与える目的はどれか。",
    "choices": [
      "部門ごとの優先順位を維持し、調整だけ責任者へ委ねる",
      "専門判断も含めて全て製品責任者だけで決める",
      "製品全体の優先順位を統一する",
      "製品目標を部門ごとに定め、競合時は予算の多い部門を優先する"
    ],
    "answer": 2,
    "choiceNotes": [
      "製品全体の優先順位は統一されない。",
      "専門部門の判断を使わず、調整権限の目的を超える。",
      "製品を軸に責任を明確にすると、部門間の優先順位を調整しやすい。",
      "製品全体での優先順位を決められない。"
    ],
    "explanation": "製品を軸に責任を明確にすると、部門間の優先順位を調整しやすい。専門部門との連携は引き続き必要である。",
    "keywords": [
      "経営・組織論"
    ],
    "status": "verified",
    "origin": "original"
  },
  {
    "id": "ap-a-0100",
    "exam": "ap",
    "topic": "ap-M22-02",
    "type": "mcq",
    "difficulty": 3,
    "section": "A",
    "question": "作業X、Y、Zを担当者P、Q、Rへ一対一で割り当てる。所要時間は下表のとおりで、合計時間を最小にする。最小値はどれか。",
    "choices": [
      "8時間",
      "11時間",
      "13時間",
      "10時間"
    ],
    "answer": 3,
    "choiceNotes": [
      "各担当者の最小時間3、2、3を足しているが、Xが重複する。",
      "P→X、Q→Z、R→Yの割当てである。",
      "P→X、Q→Y、R→Zなどの割当てである。",
      "P→Y、Q→X、R→Zで4＋2＋4＝10時間となる。"
    ],
    "explanation": "各作業を一人に限って割り当てる必要がある。P→Y、Q→X、R→Zなら4＋2＋4＝10時間で、残る五つの割当てはいずれも11時間以上である。",
    "keywords": [
      "業務分析・データ利活用"
    ],
    "status": "verified",
    "origin": "original",
    "code": "        X  Y  Z\nP       3  4  8\nQ       2  6  5\nR       7  3  4"
  },
  {
    "id": "ap-a-0101",
    "exam": "ap",
    "topic": "ap-M22-03",
    "type": "mcq",
    "difficulty": 3,
    "section": "A",
    "question": "製品の販売単価が500円、変動費が300円、期間固定費が40万円である。損益分岐点の販売数量はどれか。",
    "choices": [
      "2,000個",
      "800個",
      "1,333個",
      "4,000個"
    ],
    "answer": 0,
    "choiceNotes": [
      "1個当たりの限界利益は500−300＝200円である。",
      "固定費を販売単価で割っている。",
      "固定費を変動費で割っている。",
      "単位当たり限界利益を100円と誤っている。"
    ],
    "explanation": "1個当たりの限界利益は500−300＝200円である。40万円/200円＝2,000個で固定費を回収する。",
    "keywords": [
      "会計・財務"
    ],
    "status": "verified",
    "origin": "original"
  },
  {
    "id": "ap-a-0102",
    "exam": "ap",
    "topic": "ap-M22-03",
    "type": "mcq",
    "difficulty": 3,
    "section": "A",
    "question": "投資額100万円に対し、1年後に確実に110万円が回収できる。割引率5%なら正味現在価値に最も近い値はどれか。",
    "choices": [
      "約−4.8万円",
      "約4.8万円",
      "10万円",
      "約15万円"
    ],
    "answer": 1,
    "choiceNotes": [
      "投資と現在価値の差の符号が逆である。",
      "回収額の現在価値は110/1.05＝約104.76万円である。",
      "将来額を割り引いていない。",
      "割引を加算している。"
    ],
    "explanation": "回収額の現在価値は110/1.05＝約104.76万円である。投資額100万円を引くとNPVは約4.76万円となる。",
    "keywords": [
      "会計・財務"
    ],
    "status": "verified",
    "origin": "original"
  },
  {
    "id": "ap-a-0103",
    "exam": "ap",
    "topic": "ap-M23-01",
    "type": "mcq",
    "difficulty": 2,
    "section": "A",
    "question": "新製品の説明文に第三者が撮影した写真を載せたい。適切な初動はどれか。",
    "choices": [
      "出典を表示すれば、写真の商用掲載の許諾は不要と考える",
      "写真の一部を切り取れば、元の権利の確認は不要と考える",
      "利用許諾の範囲を確認し、必要な許可を得る",
      "社内資料での利用許諾があれば、公開範囲にもそのまま適用する"
    ],
    "answer": 2,
    "choiceNotes": [
      "出典表示と利用許諾は別の事項である。",
      "加工しても元の写真の権利が消えるわけではない。",
      "写真の利用には権利者の許諾条件を確認する。",
      "利用場所や目的で許諾範囲が異なり得る。"
    ],
    "explanation": "写真の利用には権利者の許諾条件を確認する。掲載媒体や改変の可否も利用範囲に含めて確認する。",
    "keywords": [
      "知的財産権"
    ],
    "status": "verified",
    "origin": "original"
  },
  {
    "id": "ap-a-0104",
    "exam": "ap",
    "topic": "ap-M23-04",
    "type": "mcq",
    "difficulty": 3,
    "section": "A",
    "question": "A社は顧客の削除依頼を受けた。会員データは主システムと分析用複製にあり、バックアップには別の保存期限がある。適切な管理方法はどれか。",
    "choices": [
      "主システムの保存先だけを調べ、複製先は次の定期処理に任せる",
      "複製先を含めて一律に即時消去し、保存義務の確認は省く",
      "依頼の受付だけを記録し、各保存先の処理は記録しない",
      "保存先と複製経路を把握し、適用される手順に沿って処理を記録する"
    ],
    "answer": 3,
    "choiceNotes": [
      "複製先の対応状況が不明になる。",
      "保存期限や適用手順を確認していない。",
      "各保存先の処理完了を追跡できない。",
      "複製とバックアップを含め、適用される手順ごとに処理を追跡できる。"
    ],
    "explanation": "複製先やバックアップごとに適用される保存手順が異なり得る。まず保存先と複製経路を把握し、適用される手順に沿って処理と記録を残す。",
    "keywords": [
      "その他の法律・ガイドライン・技術者倫理"
    ],
    "status": "verified",
    "origin": "original"
  },
  {
    "id": "ap-a-0105",
    "exam": "ap",
    "topic": "ap-M23-05",
    "type": "mcq",
    "difficulty": 2,
    "section": "A",
    "question": "異なる機器のログを一つの監視基盤へ取り込む。標準化された形式を採用する主な効果はどれか。",
    "choices": [
      "機器ごとの変換を減らし相互運用しやすくする",
      "機器ごとの変換規則を個別に増やし、ログの意味を統一する",
      "ログ転送を暗号化し、機器間の形式差を解消する",
      "収集時にすべてのログを同じ時刻へ補正する"
    ],
    "answer": 0,
    "choiceNotes": [
      "共通形式があれば機器ごとの取り込み処理を減らせる。",
      "標準形式を採用する主な効果は個別変換の削減である。",
      "暗号化は機密性を高めるが形式をそろえない。",
      "時刻補正は分析を助けるが、項目形式の互換性とは別である。"
    ],
    "explanation": "共通形式があれば機器ごとの取り込み処理を減らせる。異なる製品間で解析基盤を共有しやすい。",
    "keywords": [
      "標準化関連"
    ],
    "status": "verified",
    "origin": "original"
  }
]
