[
  {
    "id": "ap-a-0090",
    "exam": "ap",
    "topic": "ap-M19-01",
    "type": "mcq",
    "difficulty": 2,
    "section": "A",
    "question": "市場成長率は高いが自社シェアは低い事業へ投資を検討する。成長・シェアの二軸で整理すると位置付けはどれか。",
    "choices": [
      "負け犬",
      "問題児",
      "花形",
      "金のなる木"
    ],
    "answer": 1,
    "choiceNotes": [
      "低成長かつ低シェアである。",
      "成長率が高くシェアが低い事業は問題児に分類される。",
      "高成長かつ高シェアである。",
      "低成長かつ高シェアである。"
    ],
    "explanation": "成長率が高くシェアが低い事業は問題児に分類される。投資してシェアを高めるかを検討する。",
    "keywords": [
      "経営戦略手法"
    ],
    "status": "verified",
    "origin": "original"
  },
  {
    "id": "ap-a-0091",
    "exam": "ap",
    "topic": "ap-M19-02",
    "type": "mcq",
    "difficulty": 3,
    "section": "A",
    "question": "広告Aは費用20万円で獲得顧客の粗利益が30万円、広告Bは費用30万円で粗利益が42万円だった。広告費1円当たりの粗利益が高いのはどちらか。",
    "choices": [
      "Aで、広告費1円当たり1.4円",
      "Bで、広告費1円当たり1.5円",
      "Aで、広告費1円当たり1.5円",
      "Bで、広告費1円当たり1.4円"
    ],
    "answer": 2,
    "choiceNotes": [
      "Aの比率をBの値で計算している。",
      "Bの比率をAの値で計算している。",
      "Aは30/20＝1.5、Bは42/30＝1.4である。",
      "Bの比率は正しいが、Aのほうが高い。"
    ],
    "explanation": "広告費1円当たりの粗利益はAが30/20＝1.5円、Bが42/30＝1.4円である。Aのほうが広告費に対する粗利益が高い。",
    "keywords": [
      "マーケティング"
    ],
    "status": "verified",
    "origin": "original"
  },
  {
    "id": "ap-a-0092",
    "exam": "ap",
    "topic": "ap-M19-03",
    "type": "mcq",
    "difficulty": 2,
    "section": "A",
    "question": "新サービスの目標を「顧客維持率を半年で80%から85%へ高める」と定めた。この指標の役割はどれか。",
    "choices": [
      "顧客維持の施策に投入する予算の上限",
      "新サービスの対象顧客を分ける基準",
      "月次の売上を確定する会計上の測定値",
      "戦略の達成度を測るKPI"
    ],
    "answer": 3,
    "choiceNotes": [
      "これは投入資源であり、達成度を測る指標とは異なる。",
      "顧客を分類する用途ではなく、成果の変化を測る指標である。",
      "維持率は会計上の売上額そのものではない。",
      "顧客維持率は戦略の進捗を定量的に追える指標である。"
    ],
    "explanation": "顧客維持率は戦略の進捗を定量的に追える指標である。期限と目標値があるので達成度を判断できる。",
    "keywords": [
      "ビジネス戦略と目標・評価"
    ],
    "status": "verified",
    "origin": "original"
  },
  {
    "id": "ap-a-0093",
    "exam": "ap",
    "topic": "ap-M19-04",
    "type": "mcq",
    "difficulty": 2,
    "section": "A",
    "question": "複数事業部が同じ顧客に別々の価格を提示している。組織横断で利益を管理するための初動はどれか。",
    "choices": [
      "顧客別の売上・費用を可視化し、価格の意思決定権限を明確にする",
      "事業部ごとの売上高だけを比較して価格を統一する",
      "全顧客へ一律価格を適用して部門差を消す",
      "顧客IDを部門別のまま維持し、部門別利益だけを追う"
    ],
    "answer": 0,
    "choiceNotes": [
      "顧客別の収益性と権限を把握できる。",
      "顧客別の費用や権限を見ないと全社利益を判断できない。",
      "顧客ごとの採算を見ずに価格を決めることになる。",
      "同じ顧客を全社でまとめて評価できない。"
    ],
    "explanation": "顧客別の収益性を共通の枠組みで把握する。価格判断の権限を明確にすれば、部門間の不整合を調整できる。",
    "keywords": [
      "経営管理システム"
    ],
    "status": "verified",
    "origin": "original"
  },
  {
    "id": "ap-a-0094",
    "exam": "ap",
    "topic": "ap-M20-01",
    "type": "mcq",
    "difficulty": 2,
    "section": "A",
    "question": "新しい画像認識技術を製品へ適用する前に、不確実性の高い性能を小さく検証したい。適切なのはどれか。",
    "choices": [
      "競合の公開値を基準に、社内で画像を試さず採用する",
      "代表データで達成基準を定めた技術検証を行う",
      "量産後に全画像を集めて初めて性能を評価する",
      "試作で良好だった画像だけを使い達成と判定する"
    ],
    "answer": 1,
    "choiceNotes": [
      "自社の対象画像で達成可能か分からない。",
      "代表データと達成基準を決めた検証で技術的な実現性を測る。",
      "不確実性を小さく検証する目的に合わない。",
      "代表性のない標本では実運用の性能を見積もれない。"
    ],
    "explanation": "代表データと達成基準を決めた検証で技術的な実現性を測る。結果を基に投資や開発計画を判断できる。",
    "keywords": [
      "技術開発戦略の立案"
    ],
    "status": "verified",
    "origin": "original"
  },
  {
    "id": "ap-a-0095",
    "exam": "ap",
    "topic": "ap-M20-02",
    "type": "mcq",
    "difficulty": 2,
    "section": "A",
    "question": "A社では新素材の耐熱試験の結果によって量産装置の仕様が決まる。装置の手戻りを抑える技術開発計画で、両作業の間に明示すべきものはどれか。",
    "choices": [
      "耐熱試験回数と装置試作回数の配分",
      "耐熱試験と装置設計を同時開始する日程",
      "耐熱試験結果の確定時期と装置設計を始める条件",
      "発売日と量産開始日を固定した目標日程"
    ],
    "answer": 2,
    "choiceNotes": [
      "作業量は分かるが、結果をいつ設計へ渡せるか分からない。",
      "依存を無視すると試験結果で装置設計をやり直すおそれがある。",
      "先行する試験の完了条件と後続設計の開始条件を結び付けられる。",
      "最終期日だけでは前後の依存を管理できない。"
    ],
    "explanation": "量産装置の仕様は耐熱試験の結果に依存する。試験結果の確定時期と装置設計の開始条件を計画に示せば、未確定情報による手戻りを抑えやすい。",
    "keywords": [
      "技術開発計画"
    ],
    "status": "verified",
    "origin": "original"
  },
  {
    "id": "ap-a-0096",
    "exam": "ap",
    "topic": "ap-M21-01",
    "type": "mcq",
    "difficulty": 3,
    "section": "A",
    "question": "小売店では前月より販売が増え、仕入先の納期も延びた。欠品を抑える発注判断で、現在庫に加えて優先して更新すべきデータの組はどれか。",
    "choices": [
      "直近の販売実績だけ",
      "補充リードタイムと現在庫だけ",
      "平均在庫と発注回数だけ",
      "販売実績と補充リードタイム"
    ],
    "answer": 3,
    "choiceNotes": [
      "仕入れが届くまでの期間の変化を反映できない。",
      "販売増による需要の変化を反映できない。",
      "需要と入荷までの期間を直接把握できない。",
      "需要の増加と納期の延長の両方を反映できる。"
    ],
    "explanation": "発注判断では、補充までに売れる数量を見積もる必要がある。販売実績と補充リードタイムを更新すれば、需要と納期の変化の両方を反映できる。",
    "keywords": [
      "ビジネスシステム"
    ],
    "status": "verified",
    "origin": "original"
  },
  {
    "id": "ap-a-0097",
    "exam": "ap",
    "topic": "ap-M21-02",
    "type": "mcq",
    "difficulty": 2,
    "section": "A",
    "question": "製造工程で設備の異常停止を減らしたい。センサ値を用いた予知保全の進め方はどれか。",
    "choices": [
      "正常時と故障前のデータを比べ、異常兆候を検知する",
      "一定時間ごとの交換履歴だけを使い故障前のセンサ値を見ない",
      "正常時データだけで閾値を決め、故障前との違いを検証しない",
      "故障後の修理時間を短縮する計画だけを立てる"
    ],
    "answer": 0,
    "choiceNotes": [
      "故障前に現れる温度や振動などの変化を分析する。",
      "時間基準保全であり、異常兆候の検知ではない。",
      "故障の前兆を識別できるか確認できない。",
      "停止後の対応であり、停止前の予測ではない。"
    ],
    "explanation": "故障前に現れる温度や振動などの変化を分析する。兆候を検知して停止前に点検を計画できる。",
    "keywords": [
      "エンジニアリングシステム"
    ],
    "status": "verified",
    "origin": "original"
  },
  {
    "id": "ap-a-0098",
    "exam": "ap",
    "topic": "ap-M21-03",
    "type": "mcq",
    "difficulty": 3,
    "section": "A",
    "question": "通販で決済サービスの通知が遅れ、出荷サービスの更新は先に届くことがある。「決済済みかつ出荷前」の注文へだけ案内を送る設計として適切なのはどれか。",
    "choices": [
      "決済IDと注文IDだけを連携し、出荷状態は独立に集計する",
      "注文・決済・出荷の状態と識別子を一貫して連携する",
      "注文IDと出荷状態だけを連携し、決済状態は日次合計で渡す",
      "三システムの状態を合計件数だけで交換する"
    ],
    "answer": 1,
    "choiceNotes": [
      "注文ごとの出荷前判定ができない。",
      "遅れて届く状態も同じ注文へ結び付けて判定できる。",
      "注文ごとの決済完了を判断できない。",
      "個々の注文の状態を組み合わせられない。"
    ],
    "explanation": "通知の到着順が前後しても、注文IDを軸に決済と出荷の状態を対応付ける必要がある。両状態が確定した時点で条件に合う注文だけを抽出する。",
    "keywords": [
      "e-ビジネス"
    ],
    "status": "verified",
    "origin": "original"
  },
  {
    "id": "ap-b-0004",
    "exam": "ap",
    "topic": "ap-M19-01",
    "type": "self",
    "difficulty": 2,
    "section": "B",
    "question": "食品会社が定期購入サービスを検討している。\n既存顧客の継続率は高いが、新規獲得費が増えている。\n営業部は値引き、商品部は限定品の投入を提案した。\n予算は一施策分しかない。\n経営層は短期売上だけでなく継続利益を重視する。\n問：施策を比較する際の指標を一つ挙げ、理由を述べよ。",
    "modelAnswer": "顧客生涯価値を獲得費と比べる。継続利益まで含めて施策の採算を評価できる。",
    "rubric": [
      "継続利益を捉える指標を挙げる",
      "獲得費との比較を含める",
      "短期売上だけに依存しない理由を示す"
    ],
    "explanation": "継続購入型の事業では初回売上だけでは採算を判断できない。顧客生涯価値と獲得費を同じ前提で比べる。",
    "keywords": [
      "経営戦略手法"
    ],
    "status": "verified",
    "origin": "original"
  }
]
